{
  "v": "ACDC10JSON00011c_",
  "d": "EMqNHUFjZNmyYzT32xGbzFoBMfCNOtACXCi1xgtpMLEp",
  "i": "EMRlhEQK44_V5804rsRvQ99Gtf7uDpYQqZuvrw0LhV3S",
  "ri": "EKfi58Jiv-NVqr6GOrxgxzhrE5RsDaH4QNwv9rCyZCwZ",
  "s": "EMwdW1RO1TvOmTMrli_fej8GYn-3tSl27xMyDDf0jigK",
  "a": {
    "d": "",
    "u": "0AAt-NwGI1OZzj7e52Jq9JDD",
    "i": "EP4CmMn6ZTM3oTq-iI-2TQdlwdMXF6a2WFWaeQQRULsn",
    "knownAs": "Alice",
    "minutes": 10,
    "dt": "2023-03-13T16:15:07.686737+00:00",
    "biometricHashes": ["EDIai3Wkd-Z_4cezz9nYEcCK3KNH5saLvZoS_84JL6NU"],
    "confirmedHandles": ["twitter:aliceIsntInWonderland", "mailto:alice@example.com", "github:alice-the-cryptoqueen"],
    "basis": "acquaintance",
    "caveats": "Loud conference; hard to hear Alice speaking."
  },
  "r": "EE1ycWdqBAE_4F-WsXZM83CrjpyCClYgPeINk104bLKX"
}